header,review_text
"Which AWS service delivers data, videos, applications, and APIs to users globally with low latency and high transfer speeds?A . Amazon Route 53B . Amazon ConnectC . Amazon CloudFrontD . Amazon EC2","  Which AWS service delivers data, videos, applications, and APIs to users globally with low latency and high transfer speeds?A . Amazon Route 53B . Amazon ConnectC . Amazon CloudFrontD . Amazon EC2 View Answer Answer: B  Latest CLF-C01 Dumps Valid Version with 721 Q&As  Latest And Valid Q&A | Instant Download | Once Fail, Full Refund  Instant Download CLF-C01 PDF    CLF-C01CLF-C01 exam  "
"Which of the following steps should be taken by a customer when conducting penetration testing on AWS?A . Conduct penetration testing using Amazon Inspector, and then notify AWS support.B . Request and wait for approval from the customer’s internal security team, and then conduct testing.C . Notify AWS support, and then conduct testing immediately.D . Request and wait for approval from AWS support, and then conduct testing.","  Which of the following steps should be taken by a customer when conducting penetration testing on AWS?A . Conduct penetration testing using Amazon Inspector, and then notify AWS support.B . Request and wait for approval from the customer’s internal security team, and then conduct testing.C . Notify AWS support, and then conduct testing immediately.D . Request and wait for approval from AWS support, and then conduct testing. View Answer Answer: B Explanation: AWS customers are welcome to carry out security assessments or penetration tests against their AWS infrastructure without prior approval for 8 services.  Latest CLF-C01 Dumps Valid Version with 721 Q&As  Latest And Valid Q&A | Instant Download | Once Fail, Full Refund  Instant Download CLF-C01 PDF    CLF-C01CLF-C01 exam  "
Which AWS Cost Management tool allows you to view the most granular data about your AWS bill?A . AWS Cost ExplorerB . AWS BudgetsC . AWS Cost and Usage reportD . AWS Billing dashboard,"  Which AWS Cost Management tool allows you to view the most granular data about your AWS bill?A . AWS Cost ExplorerB . AWS BudgetsC . AWS Cost and Usage reportD . AWS Billing dashboard View Answer Answer: C Explanation: The AWS Billing Console gives you access to the most comprehensive information about your AWS costs and usage. To see how your costs are tracking month-to-date, and which AWS services are the main cost drivers, check out the AWS Billing Dashboard. To access to the most comprehensive information about your AWS costs and usage, you can download the AWS Cost & Usage Report. To view your bill for any previous month, you can access the Bills page. https://aws.amazon.com/aws-cost-management/details/  Latest CLF-C01 Dumps Valid Version with 721 Q&As  Latest And Valid Q&A | Instant Download | Once Fail, Full Refund  Instant Download CLF-C01 PDF    CLF-C01CLF-C01 exam  "
Which element of the AWS global infrastructure consists of one or more discrete data centers each with redundant power networking and connectivity which are housed in separate facilities?A . AWS RegionsB . Availability ZonesC . Edge locationsD . Amazon CloudFront,"  Which element of the AWS global infrastructure consists of one or more discrete data centers each with redundant power networking and connectivity which are housed in separate facilities?A . AWS RegionsB . Availability ZonesC . Edge locationsD . Amazon CloudFront View Answer Answer: B  Latest CLF-C01 Dumps Valid Version with 721 Q&As  Latest And Valid Q&A | Instant Download | Once Fail, Full Refund  Instant Download CLF-C01 PDF    CLF-C01CLF-C01 exam  "
How many Availability Zones should compute resources be provisioned across to achieve high availability?A . A minimum of oneB . A minimum of twoC . A minimum of threeD . A minimum of four or more,"  How many Availability Zones should compute resources be provisioned across to achieve high availability?A . A minimum of oneB . A minimum of twoC . A minimum of threeD . A minimum of four or more View Answer Answer: B  Latest CLF-C01 Dumps Valid Version with 721 Q&As  Latest And Valid Q&A | Instant Download | Once Fail, Full Refund  Instant Download CLF-C01 PDF    CLF-C01CLF-C01 exam  "
The AWS Cloud’s multiple Regions are an example of:A . agility.B . global infrastructure.C . elasticity.D . pay-as-you-go pricing.,"  The AWS Cloud’s multiple Regions are an example of:A . agility.B . global infrastructure.C . elasticity.D . pay-as-you-go pricing. View Answer Answer: B Explanation: https://aws.amazon.com/blogs/apn/architecting-multi-region-saas-solutions-on-aws/  Latest CLF-C01 Dumps Valid Version with 721 Q&As  Latest And Valid Q&A | Instant Download | Once Fail, Full Refund  Instant Download CLF-C01 PDF    CLF-C01CLF-C01 exam  "
Which AWS service can be used to manually launch instances based on resource requirements?A . Amazon EBSB . Amazon S3C . Amazon EC2D . Amazon ECS,"  Which AWS service can be used to manually launch instances based on resource requirements?A . Amazon EBSB . Amazon S3C . Amazon EC2D . Amazon ECS View Answer Answer: C  Latest CLF-C01 Dumps Valid Version with 721 Q&As  Latest And Valid Q&A | Instant Download | Once Fail, Full Refund  Instant Download CLF-C01 PDF    CLF-C01CLF-C01 exam  "
Which is a recommended pattern for designing a highly available architecture on AWS?A . Ensure that components have low-latency network connectivity.B . Run enough Amazon EC2 instances to operate at peak load.C . Ensure that the application is designed to accommodate failure of any single component.D . Use a monolithic application that handles all operations.,"  Which is a recommended pattern for designing a highly available architecture on AWS?A . Ensure that components have low-latency network connectivity.B . Run enough Amazon EC2 instances to operate at peak load.C . Ensure that the application is designed to accommodate failure of any single component.D . Use a monolithic application that handles all operations. View Answer Answer: C  Latest CLF-C01 Dumps Valid Version with 721 Q&As  Latest And Valid Q&A | Instant Download | Once Fail, Full Refund  Instant Download CLF-C01 PDF    CLF-C01CLF-C01 exam  "
Which AWS characteristics make AWS cost effective for a workload with dynamic user demand? (Select TWO.)A . High availabilityB . Shared security modelC . ElasticityD . Pay-as-you-go pricingE . Reliability,"  Which AWS characteristics make AWS cost effective for a workload with dynamic user demand? (Select TWO.)A . High availabilityB . Shared security modelC . ElasticityD . Pay-as-you-go pricingE . Reliability View Answer Answer: C,D  Latest CLF-C01 Dumps Valid Version with 721 Q&As  Latest And Valid Q&A | Instant Download | Once Fail, Full Refund  Instant Download CLF-C01 PDF    CLF-C01CLF-C01 exam  "
An administrator needs to rapidly deploy a popular IT solution and start using it immediately. Where can the administrator find assistance?A . AWS Well-Architected Framework documentationB . Amazon CloudFrontC . AWS CodeCommitD . AWS Quick Start reference deployments,"  An administrator needs to rapidly deploy a popular IT solution and start using it immediately. Where can the administrator find assistance?A . AWS Well-Architected Framework documentationB . Amazon CloudFrontC . AWS CodeCommitD . AWS Quick Start reference deployments View Answer Answer: D Explanation: Quick Starts are built by AWS solutions architects and partners to help you deploy popular technologies on AWS, based on AWS best practices for security and high availability. These accelerators reduce hundreds of manual procedures into just a few steps, so you can build your production environment quickly and start using it immediately.  Latest CLF-C01 Dumps Valid Version with 721 Q&As  Latest And Valid Q&A | Instant Download | Once Fail, Full Refund  Instant Download CLF-C01 PDF    CLF-C01CLF-C01 exam  "
What is one of the advantages of the Amazon Relational Database Service (Amazon RDS)?A . It simplifies relational database administration tasks.B . It provides 99.99999999999% reliability and durability.C . It automatically scales databases for loads.D . It enabled users to dynamically adjust CPU and RAM resources.,"  What is one of the advantages of the Amazon Relational Database Service (Amazon RDS)?A . It simplifies relational database administration tasks.B . It provides 99.99999999999% reliability and durability.C . It automatically scales databases for loads.D . It enabled users to dynamically adjust CPU and RAM resources. View Answer Answer: A Explanation: https://aws.amazon.com/rds/  Latest CLF-C01 Dumps Valid Version with 721 Q&As  Latest And Valid Q&A | Instant Download | Once Fail, Full Refund  Instant Download CLF-C01 PDF    CLF-C01CLF-C01 exam  "
Which of the following AWS Cloud services can be used to run a customer-managed relational database?A . Amazon EC2B . Amazon Route 53C . Amazon ElastiCacheD . Amazon DynamoDB,"  Which of the following AWS Cloud services can be used to run a customer-managed relational database?A . Amazon EC2B . Amazon Route 53C . Amazon ElastiCacheD . Amazon DynamoDB View Answer Answer: A  Latest CLF-C01 Dumps Valid Version with 721 Q&As  Latest And Valid Q&A | Instant Download | Once Fail, Full Refund  Instant Download CLF-C01 PDF    CLF-C01CLF-C01 exam  "
A user is planning to launch two additional Amazon EC2 instances to increase availability. Which action should the user take?A . Launch the instances across multiple Availability Zones in a single AWS RegionB . Launch the instances as EC2 Reserved Instances in the same AWS Region and the same Availability ZoneC . Launch the instances in multiple AWS Regions but in the same Availability ZoneD . Launch the instances as EC2 Spot Instances in the same AWS Region but in different Availability Zones,"  A user is planning to launch two additional Amazon EC2 instances to increase availability. Which action should the user take?A . Launch the instances across multiple Availability Zones in a single AWS RegionB . Launch the instances as EC2 Reserved Instances in the same AWS Region and the same Availability ZoneC . Launch the instances in multiple AWS Regions but in the same Availability ZoneD . Launch the instances as EC2 Spot Instances in the same AWS Region but in different Availability Zones View Answer Answer: A  Latest CLF-C01 Dumps Valid Version with 721 Q&As  Latest And Valid Q&A | Instant Download | Once Fail, Full Refund  Instant Download CLF-C01 PDF    CLF-C01CLF-C01 exam  "
Which of the following can limit Amazon Storage Service (Amazon S3) bucket access to specific users?A . A public and private key-pairB . Amazon InspectorC . AWS Identity and Access Management (IAM) policiesD . Security Groups,"  Which of the following can limit Amazon Storage Service (Amazon S3) bucket access to specific users?A . A public and private key-pairB . Amazon InspectorC . AWS Identity and Access Management (IAM) policiesD . Security Groups View Answer Answer: C  Latest CLF-C01 Dumps Valid Version with 721 Q&As  Latest And Valid Q&A | Instant Download | Once Fail, Full Refund  Instant Download CLF-C01 PDF    CLF-C01CLF-C01 exam  "
Which AWS service allows companies to connect an Amazon VPC to an on-premises data center?A . AWS VPNB . Amazon RedshiftC . API GatewayD . Amazon Direct Connect,"  Which AWS service allows companies to connect an Amazon VPC to an on-premises data center?A . AWS VPNB . Amazon RedshiftC . API GatewayD . Amazon Direct Connect View Answer Answer: A  Latest CLF-C01 Dumps Valid Version with 721 Q&As  Latest And Valid Q&A | Instant Download | Once Fail, Full Refund  Instant Download CLF-C01 PDF    CLF-C01CLF-C01 exam  "
Which AWS service of feature can be used to monitor CPU usage?A . AWS CloudTrailB . VPC Flow LogsC . Amazon CloudWatchD . AWSConfig,"  Which AWS service of feature can be used to monitor CPU usage?A . AWS CloudTrailB . VPC Flow LogsC . Amazon CloudWatchD . AWSConfig View Answer Answer: C  Latest CLF-C01 Dumps Valid Version with 721 Q&As  Latest And Valid Q&A | Instant Download | Once Fail, Full Refund  Instant Download CLF-C01 PDF    CLF-C01CLF-C01 exam  "
Which task is AWS responsible for in the shared responsibility model for security and compliance?A . Granting access to individuals and servicesB . Encrypting data in transitC . Updating Amazon EC2 host firmwareD . Updating operating systems,"  Which task is AWS responsible for in the shared responsibility model for security and compliance?A . Granting access to individuals and servicesB . Encrypting data in transitC . Updating Amazon EC2 host firmwareD . Updating operating systems View Answer Answer: C  Latest CLF-C01 Dumps Valid Version with 721 Q&As  Latest And Valid Q&A | Instant Download | Once Fail, Full Refund  Instant Download CLF-C01 PDF    CLF-C01CLF-C01 exam  "
"Which of the following security-related actions are available at no cost?A . Calling AWS SupportB . Contacting AWS Professional Services to request a workshopC . Accessing forums, blogs, and whitepapersD . Attending AWS classes at a local university","  Which of the following security-related actions are available at no cost?A . Calling AWS SupportB . Contacting AWS Professional Services to request a workshopC . Accessing forums, blogs, and whitepapersD . Attending AWS classes at a local university View Answer Answer: C  Latest CLF-C01 Dumps Valid Version with 721 Q&As  Latest And Valid Q&A | Instant Download | Once Fail, Full Refund  Instant Download CLF-C01 PDF    CLF-C01CLF-C01 exam  "
Which storage service can be used as a low-cost option for hosting static websites?A . Amazon GlacierB . Amazon DynamoDBC . Amazon Elastic File System (Amazon EFS)D . Amazon Simple Storage Service (Amazon S3),"  Which storage service can be used as a low-cost option for hosting static websites?A . Amazon GlacierB . Amazon DynamoDBC . Amazon Elastic File System (Amazon EFS)D . Amazon Simple Storage Service (Amazon S3) View Answer Answer: D  Latest CLF-C01 Dumps Valid Version with 721 Q&As  Latest And Valid Q&A | Instant Download | Once Fail, Full Refund  Instant Download CLF-C01 PDF    CLF-C01CLF-C01 exam  "
